{"artifact_type":"c0_plan_review","reviewed_plan_hash":"sha256:bd54f1b36e2b6edddd11618a4dd43180ea20b7a7b9182fdad9130a4e9119e9cc","reviewed_head":"6337aade0717e547a77844dc99861056afdc7586","input_manifest_hash":"sha256:0826278a094850e61657906f3559af29cccb8c81aa73778c3cf8d3879e1a5e1c","review_status":"findings","blocking_findings":true,"findings":[{"severity":"high","area":"repo mismatch / grounding","finding":"The plan is stale against the reviewed head. Step 4 says README.md:3 is v2.69.0 while main is v2.83.1, but at 6337aade README.md:3 is v2.84.0 and the plugin release metadata is v2.85.0. Step 5 also states gate_profile_defaults is null, but the reviewed config defines step: targeted and epic: standard. The plan's diagnosis, release reproduction baseline, and migration rationale are therefore not grounded in the repository it is to change.","recommendation":"Re-ground all affected steps at the reviewed head before EPIC generation. Update the concrete release baseline and Step 5 execution-path reasoning, then re-run the stated reproductions and revise tests/acceptance text to match current behavior.","action_owner":"reviewer"},{"severity":"high","area":"scope / testability","finding":"Step 4 includes a Modify action for .aid-o/config/project.yaml even though it is ignored and untracked. The plan explicitly acknowledges the change reaches only the current workspace. It cannot be delivered in an EPIC commit, is absent from clones and ordinary worktrees, and no tracked acceptance check can establish that the actual configuration was repaired; the proposed test can only exercise a copied pattern.","recommendation":"Remove the workspace-only mutation from the implementation deliverable and retain a tracked regression fixture, or explicitly create a separately authorized operational-remediation step with a reproducible target and completion evidence. Do not represent an uncommittable local edit as a plan implementation file.","action_owner":"pm"},{"severity":"medium","area":"scope completeness","finding":"Step 2 directs the implementer to leave a comment in plugins/aid-orchestrator/scripts/lib/aid-scoping.sh, but that file is absent from Step 2's Files list. The repository derives per-step allowed paths from that list, so the prescribed edit is out of scope.","recommendation":"Either add aid-scoping.sh to Step 2's Files list with the intended comment, or remove the comment instruction."},{"severity":"medium","area":"contracts / acceptance criteria","finding":"Step 9 requires a “text-derived substitute” for the absent dependency graph but never defines its source, extraction rules, or required output. Its test only checks that the prompt does not require an absent artifact, so it cannot verify that the reviewer receives a usable replacement for dependency analysis.","recommendation":"Specify the substitute precisely, for example the plan's numbered Dependencies sections and the required cycle/output analysis, and add a fixture-based test proving the rendered prompt directs that check when both graph fields are absent."}]}